"slug","title","body_region","decision_type","is_operative","canonical_question","option_a_label","option_b_label","expected_equipoise","equipoise_rationale","label_provenance"
"midfoot-lisfranc-injury-ligamentous-orif-vs-arthrodesis","Ligamentous Lisfranc injury: ORIF vs primary arthrodesis","foot_ankle","which_operation","true","In an adult with an acute purely ligamentous Lisfranc joint injury, is ORIF or primary arthrodesis preferred?","Open reduction internal fixation","Primary arthrodesis","genuine_equipoise","Primary arthrodesis reduces the high rate of secondary salvage fusion and provides predictable stability, but sacrifices midfoot joint motion compared to ORIF.","literature"
"carpal-tunnel-syndrome-moderate-release-vs-splint","Moderate carpal tunnel syndrome: surgical release vs splinting and injection","wrist_hand","conservative_vs_operative","true","In an adult with moderate symptomatic carpal tunnel syndrome, is surgical release or splinting with corticosteroid injection preferred?","Splinting and injection","Surgical release","genuine_equipoise","Conservative therapy provides good temporary relief, but surgical release provides superior, long-term resolution of symptoms and nerve compression.","literature"
"metatarsal-5th-jones-fracture-cast-vs-screw","Acute Jones fracture (5th metatarsal): casting vs percutaneous screw fixation","foot_ankle","conservative_vs_operative","true","In an active adult with an acute Jones fracture (5th metatarsal zone II), is nonoperative non-weightbearing casting or percutaneous screw fixation preferred?","Non-weightbearing casting","Percutaneous screw fixation","genuine_equipoise","Surgery results in faster union and quicker return to activity, particularly in athletes, but carries risk of hardware pain; casting is non-invasive but has higher nonunion rates.","literature"
"greater-tuberosity-fracture-displaced-nonop-vs-orif","Displaced isolated greater tuberosity fracture: nonoperative vs surgery","shoulder","conservative_vs_operative","true","In an adult with a displaced (>5mm) isolated greater tuberosity fracture, is nonoperative management or surgical fixation preferred?","Nonoperative management","Surgical fixation","genuine_equipoise","Displacement can cause subacromial impingement, arguing for surgical fixation, yet nonoperative management with close observation often yields acceptable functional outcomes.","literature"
"ankle-instability-chronic-rehab-vs-brostrom","Chronic lateral ankle instability: functional rehabilitation vs Brostrom repair","foot_ankle","conservative_vs_operative","true","In an adult with chronic symptomatic lateral ankle instability, is progressive functional rehabilitation or surgical Brostrom-Gould repair preferred?","Functional rehabilitation","Surgical Brostrom repair","genuine_equipoise","High-quality rehabilitation stabilizes many ankles dynamically; surgical repair is highly effective for persistent mechanical instability but risks nerve injury and stiffness.","literature"
"proximal-humerus-neer-2-part-nonop-vs-orif","Displaced Neer 2-part proximal humerus fracture: nonoperative vs surgical fixation","shoulder","conservative_vs_operative","true","In an adult with a displaced Neer 2-part proximal humerus fracture, is nonoperative management or surgical fixation preferred?","Nonoperative management","Surgical fixation","genuine_equipoise","Surgical fixation restores anatomy but adds complications (screws cutout, avascular necrosis); nonoperative care accepts deformity but avoids operative risks.","literature"
"gluteus-medius-tear-repair-vs-nonop","Symptomatic gluteus medius tear: endoscopic/open repair vs physical therapy","hip","conservative_vs_operative","true","In an adult with a chronic symptomatic gluteus medius or minimus tear, is structured physical therapy or surgical repair preferred?","Structured physical therapy","Surgical repair","genuine_equipoise","Repair provides good clinical improvement in tendon integrity and pain relief, but physical therapy remains a highly effective, lower-risk first-line option.","literature"
"elbow-epicondylitis-lateral-surgery-vs-conservative","Chronic lateral epicondylitis: debridement vs structured conservative therapy","elbow","conservative_vs_operative","true","In an adult with chronic, recalcitrant lateral epicondylitis, is surgical debridement or structured conservative therapy preferred?","Structured conservative therapy","Surgical debridement","genuine_equipoise","Debridement (Nirschl procedure) can resolve pain in refractory cases, but long-term outcomes often show little difference from natural history and persistent physical therapy.","literature"
"tibial-plateau-schatzker-ii-orif-vs-nonop","Schatzker Type II tibial plateau fracture: nonoperative vs ORIF","lower_leg","conservative_vs_operative","true","In an adult with a Schatzker Type II tibial plateau fracture and <5mm of articular depression, is nonoperative non-weightbearing or ORIF preferred?","Nonoperative management","Open reduction internal fixation","genuine_equipoise","Minimal depression allows successful nonoperative management; surgery restores articular surface alignment but carries wound healing and infection risks.","literature"
"adhesive-capsulitis-steroid-vs-hydrodilatation","Adhesive capsulitis: corticosteroid injection vs hydrodilatation","shoulder","which_intervention","false","In an adult with primary adhesive capsulitis, is intra-articular corticosteroid injection or hydrodilatation preferred?","Corticosteroid injection","Hydrodilatation","genuine_equipoise","Both interventions provide rapid, temporary pain relief and range of motion improvement, but trials show conflicting evidence regarding the superior efficacy of hydrodilatation over standard injection.","literature"
"femoral-shaft-fracture-retrograde-vs-antegrade-nail","Femoral shaft fracture: retrograde vs antegrade intramedullary nailing","hip","which_operation","true","In an adult with a femoral shaft fracture, is retrograde or antegrade intramedullary nailing preferred?","Antegrade nailing","Retrograde nailing","genuine_equipoise","Both techniques achieve high union rates; antegrade nailing risks hip pain and heterotopic ossification, while retrograde nailing risks knee pain and intra-articular irritation.","literature"
"hallux-rigidus-cheilectomy-vs-arthrodesis","Hallux rigidus (stage III): cheilectomy vs primary arthrodesis","foot_ankle","which_operation","true","In an adult with Stage III hallux rigidus, is joint-preserving cheilectomy or primary arthrodesis preferred?","Joint-preserving cheilectomy","Primary joint arthrodesis","genuine_equipoise","Cheilectomy preserves motion but carries high rates of persistent pain and conversion to fusion; arthrodesis provides definitive pain relief but permanently eliminates joint motion.","literature"
"intervertebral-disc-herniation-cervical-acdf-vs-adr","Cervical disc herniation: ACDF vs artificial disc replacement","spine","which_operation","true","In an adult with single-level cervical disc herniation requiring surgery, is ACDF or artificial disc replacement (ADR) preferred?","Anterior cervical discectomy and fusion","Cervical artificial disc replacement","genuine_equipoise","ADR preserves motion and may reduce adjacent segment disease, but long-term registry data are still accumulating compared to the gold-standard ACDF.","literature"
"scaphoid-nonunion-vascularized-vs-nonvascularized-graft","Scaphoid nonunion: vascularized vs non-vascularized bone graft","wrist_hand","which_operation","true","In an adult with a scaphoid proximal pole nonunion, is vascularized or non-vascularized bone grafting preferred?","Non-vascularized bone graft","Vascularized bone graft","genuine_equipoise","Vascularized grafts theoretically enhance healing in avascular segments, but clinical trials show variable benefit over traditional non-vascularized grafting techniques.","literature"
"hip-oa-advanced-anterior-vs-posterior","Advanced hip osteoarthritis: direct anterior vs posterior approach total hip arthroplasty","hip","which_operation","true","In an adult undergoing total hip arthroplasty for hip osteoarthritis, is the direct anterior or posterior approach preferred?","Posterior approach","Direct anterior approach","genuine_equipoise","Direct anterior approach may reduce early dislocation rates and speed early recovery, but posterior approach offers excellent visualization, lower fracture rates, and similar mid-term outcomes.","literature"
"total-knee-arthroplasty-cr-vs-ps","Total knee arthroplasty: cruciate-retaining vs posterior-stabilized","knee","which_operation","true","In an adult undergoing total knee arthroplasty, is a cruciate-retaining (CR) or posterior-stabilized (PS) design preferred?","Cruciate-retaining design","Posterior-stabilized design","genuine_equipoise","CR preserves natural kinematics and bone stock, while PS provides predictable stability and easier balancing; long-term functional and implant survival outcomes are equivalent.","literature"
"patellofemoral-instability-mpfl-vs-ttat","Patellofemoral instability: isolated MPFL reconstruction vs MPFL with tibial tubercle osteotomy","knee","which_operation","true","In a patient with recurrent patellar dislocation and borderline TT-TG distance, is isolated MPFL reconstruction or combined MPFL with tibial tubercle osteotomy preferred?","Isolated MPFL reconstruction","Combined MPFL and tubercle osteotomy","genuine_equipoise","Combined surgery directly corrects bony malalignment but is more invasive; isolated soft-tissue reconstruction is less invasive but may under-address biomechanical drivers.","literature"
"acdf-vs-cervical-disc-arthroplasty","Cervical disc disease: ACDF vs cervical artificial disc replacement","spine","which_operation","true","In an adult with symptomatic single-level cervical disc disease, is ACDF or cervical artificial disc replacement (ADR) preferred?","Anterior cervical discectomy and fusion","Cervical artificial disc replacement","genuine_equipoise","ADR preserves segmental cervical motion and potentially reduces adjacent segment disease, but long-term cohort survivorship data are still accumulating compared to standard ACDF.","literature"
"femoral-neck-fracture-undisplaced-screws-vs-hemi","Undisplaced femoral neck fracture (elderly): internal fixation vs hemiarthroplasty","hip","which_operation","true","In an active elderly patient with an undisplaced femoral neck fracture, is parallel screw internal fixation or hemiarthroplasty preferred?","Parallel screw internal fixation","Hemiarthroplasty","genuine_equipoise","Internal fixation preserves native anatomy but has high rates of late displacement and avascular necrosis; primary hemiarthroplasty allows immediate stable weightbearing but is more invasive.","literature"
"developmental-dysplasia-hip-closed-vs-open-reduction","Developmental dysplasia of the hip: closed vs open reduction","hip","which_operation","true","In an infant with developmental dysplasia of the hip failing bracing, is closed reduction or open surgical reduction preferred?","Closed manual reduction","Open surgical reduction","genuine_equipoise","Closed reduction under anesthesia is less invasive but has higher failure and osteonecrosis rates in select patterns; open reduction provides definitive clearance but carries surgical morbidity.","literature"
"pediatric-femur-fracture-elastic-nails-vs-spica","Pediatric femur fracture (age 2-6): elastic stable intramedullary nails vs spica cast","hip","which_operation","true","In a young child (age 2-6) with a displaced femoral shaft fracture, is percutaneous elastic stable intramedullary nailing (ESIN) or spica casting preferred?","Spica casting immobilization","Elastic stable intramedullary nailing","genuine_equipoise","ESIN allows rapid mobilization and social convenience but carries anesthetic and hardware removal risks; spica casting avoids hardware surgery but imposes profound caregiving challenges.","literature"
"carpal-tunnel-endoscopic-vs-open-release","Carpal tunnel syndrome: endoscopic vs open surgical release","wrist_hand","which_operation","true","In an adult with severe carpal tunnel syndrome, is endoscopic or open surgical release preferred?","Open carpal tunnel release","Endoscopic carpal tunnel release","genuine_equipoise","Endoscopic release offers faster early recovery and less scar tenderness, but carries a slightly higher risk of transient nerve injury and incomplete transverse ligament release compared to open.","literature"
"intertrochanteric-fracture-nail-vs-sliding-hip-screw","Intertrochanteric hip fracture: cephalomedullary nail vs sliding hip screw","hip","which_operation","true","In an adult with a stable intertrochanteric hip fracture, is cephalomedullary nailing or sliding hip screw (SHS) fixation preferred?","Sliding hip screw fixation","Cephalomedullary nailing","genuine_equipoise","Nailing offers theoretical biomechanical advantages but is more costly and has a risk of femoral split; sliding hip screws have a long track record of safety in stable patterns.","literature"
"proximal-humerus-orif-vs-reverse-shoulder-arthroplasty","Proximal humerus fracture: surgical plating vs primary reverse shoulder arthroplasty","shoulder","which_operation","true","In an active elderly patient with a displaced 3- or 4-part proximal humerus fracture, is ORIF or primary reverse shoulder arthroplasty (RSA) preferred?","Open reduction internal fixation","Reverse shoulder arthroplasty","genuine_equipoise","ORIF preserves native anatomy but carries high risks of osteonecrosis and screw cutout; primary RSA provides predictable early function but limits long-term revision options.","literature"
"tibial-plateau-fracture-orif-vs-exfix","Tibial plateau fracture: ORIF vs staged external fixation and spanning","lower_leg","which_operation","true","In an adult with a high-energy bicondylar tibial plateau fracture, is primary ORIF or staged external fixation followed by delayed reconstruction preferred?","Primary open reduction internal fixation","Staged spanning external fixation","genuine_equipoise","Primary ORIF allows anatomical reduction but carries high wound complication rates in swollen tissue; staged external fixation protects soft tissues but delays anatomical reconstruction.","literature"
"rotator-cuff-tear-single-vs-double-row-repair","Rotator cuff repair: single-row vs double-row suture anchor fixation","shoulder","which_operation","true","When surgical repair of a medium-to-large rotator cuff tear is indicated, is a single-row or double-row suture anchor technique preferred?","Single-row suture anchor repair","Double-row suture anchor repair","genuine_equipoise","Double-row repair provides superior biomechanical footprint coverage and lower re-tear rates, but single-row is faster, cheaper, and has equivalent clinical patient-reported outcomes.","literature"
"hallux-valgus-lapidus-vs-scarf-osteotomy","Severe hallux valgus: Lapidus arthrodesis vs Scarf osteotomy","foot_ankle","which_operation","true","In an adult with severe hallux valgus and first ray hypermobility, is a Lapidus tarsometatarsal arthrodesis or Scarf metatarsal osteotomy preferred?","Scarf metatarsal osteotomy","Lapidus tarsometatarsal arthrodesis","genuine_equipoise","Lapidus provides powerful multi-planar deformity correction and addresses hypermobility but requires prolonged non-weightbearing; Scarf allows faster mobilization but has higher recurrence in hypermobile rays.","literature"
"lumbar-stenosis-decompression-alone-vs-interspinous-device","Lumbar spinal stenosis: decompression alone vs decompression with interspinous spacer","spine","which_operation","true","In an adult with moderate single-level lumbar spinal stenosis, is decompression alone or decompression with insertion of an interspinous spacer preferred?","Decompression alone","Decompression with interspinous spacer","genuine_equipoise","Spacer placement preserves flexion and may limit mechanical destabilization, but increases cost, implant failure, and reoperation rates compared to gold-standard decompression alone.","literature"
"adult-spinal-deformity-long-fusion-to-l5-vs-sacrum","Adult spinal deformity: fusion terminating at L5 vs pelvic fixation to the sacrum","spine","which_operation","true","In an adult undergoing long instrumented posterior spinal fusion for deformity, is terminating the construct at L5 or extending to the sacrum/pelvis preferred?","Termination of fusion at L5","Extension of fusion to the sacrum","genuine_equipoise","Terminating at L5 preserves lumbosacral motion and reduces surgical time, but carries high rates of subsequent L5-S1 breakdown; extending to the pelvis protects L5-S1 but adds massive surgical morbidity.","literature"
"shoulder-instability-bankart-vs-latarjet","Recurrent anterior shoulder instability: arthroscopic Bankart repair vs Latarjet procedure","shoulder","which_operation","true","In a patient with recurrent anterior shoulder instability and minimal bone loss, is arthroscopic soft-tissue Bankart repair or an open Latarjet coracoid transfer preferred?","Arthroscopic Bankart repair","Open Latarjet procedure","genuine_equipoise","Latarjet dramatically reduces the recurrence rate, especially in high-risk patients, but is technically demanding with serious nerve and joint-overclosure risks compared to arthroscopic repair.","literature"
"unstable-slipping-rib-syndrome-excision-vs-stabilization","Slipping rib syndrome: surgical excision vs costal cartilage stabilization","spine","which_operation","true","In a patient with symptomatic slipping rib syndrome, is excision of the hypermobile costal cartilage segment or surgical plating/stabilization preferred?","Excision of costal cartilage","Surgical costal stabilization","genuine_equipoise","Segmental excision is simple and long-established but can lead to localized chest wall flaccidity; reconstruction/stabilization preserves chest wall integrity but adds hardware risks.","literature"
"femoral-shaft-fracture-pediatric-spica-vs-elastic-nails","Pediatric femoral shaft fracture (age 5-10): spica casting vs elastic stable intramedullary nails","lower_leg","which_operation","true","In a child aged 5-10 with a displaced femoral shaft fracture, is closed reduction and spica casting or percutaneous elastic stable intramedullary nailing preferred?","Spica casting immobilization","Elastic stable intramedullary nailing","genuine_equipoise","Nails permit rapid return to school and peer integration but require secondary removal; casting avoids invasive surgery but requires prolonged, difficult home care.","literature"
"pilon-fracture-orif-early-vs-staged-exfix","Distal tibia pilon fracture: immediate ORIF vs staged external fixation followed by delayed ORIF","lower_leg","timing_of_surgery","true","In an adult with an acute high-energy distal tibia pilon fracture, is immediate ORIF or staged spanning external fixation with delayed ORIF preferred?","Immediate open reduction internal fixation","Spanning external fixation with delayed ORIF","genuine_equipoise","Immediate ORIF secures anatomical reconstruction early but is associated with catastrophic wound breakdown and infection; staged care protects the soft tissue envelope but prolongs hospital stay.","literature"
"osteoarthritis-knee-prp-vs-hyaluronic-acid","Knee osteoarthritis: platelet-rich plasma (PRP) vs hyaluronic acid (HA) joint injection","knee","which_intervention","false","In an adult with mild-to-moderate symptomatic knee osteoarthritis, is intra-articular PRP or hyaluronic acid injection preferred?","Hyaluronic acid injection","Platelet-rich plasma injection","genuine_equipoise","Clinical trials show variable, highly contested efficacy; some meta-analyses suggest PRP provides superior anti-inflammatory symptom relief, but standard of care remains highly variable.","literature"
"patella-fracture-displaced-tension-band-vs-plate","Displaced patellar fracture: tension-band wiring vs low-profile plate fixation","knee","which_operation","true","In an adult with a displaced patellar fracture requiring surgery, is traditional tension-band wiring or low-profile plate fixation preferred?","Tension-band wire fixation","Low-profile plate fixation","genuine_equipoise","Tension-band wiring is highly established but has a hardware removal rate of up to 40% due to prominent wires; plate fixation offers superior multi-planar stability but increases cost.","literature"
"hip-arthroscop-labral-repair-vs-debridement","Femoroacetabular impingement: labral repair vs labral debridement during arthroscopy","hip","which_operation","true","During hip arthroscopy for FAI, is labral repair or labral debridement preferred?","Labral debridement","Labral repair","genuine_equipoise","Repair preserves the suction-seal of the hip and slows cartilage degeneration, but is technically demanding and costly; debridement is fast and simple but may accelerate arthritis.","literature"
"lumbar-disc-herniation-endoscopic-vs-microdiscectomy","Lumbar disc herniation: endoscopic vs open microdiscectomy","spine","which_operation","true","In an adult with symptomatic lumbar disc herniation, is endoscopic discectomy or standard open microdiscectomy preferred?","Open microdiscectomy","Endoscopic discectomy","genuine_equipoise","Endoscopic approaches minimize paraspinal muscle dissection and shorten hospital recovery, but have a steep learning curve and similar long-term outcomes to open microdiscectomy.","literature"
"cervical-radiculopathy-posterior-foraminotomy-vs-acdf","Cervical radiculopathy: posterior foraminotomy vs anterior cervical discectomy and fusion","spine","which_operation","true","In an adult with single-level posterolateral cervical radiculopathy, is posterior foraminotomy or ACDF preferred?","Posterior cervical foraminotomy","Anterior cervical discectomy and fusion","genuine_equipoise","Posterior foraminotomy avoids fusion and preserves motion but carries higher postoperative muscle pain; ACDF is highly reliable for nerve clearance but sacrifices segmental motion.","literature"
"hamstring-tendon-avulsion-operative-vs-nonoperative","Proximal hamstring tendon avulsion: nonoperative rehabilitation vs surgical repair","hip","conservative_vs_operative","true","In an active adult with a complete 2-tendon proximal hamstring avulsion, is nonoperative rehabilitation or surgical repair preferred?","Nonoperative rehabilitation","Surgical repair","genuine_equipoise","Surgical repair preserves peak power and reduces hamstring fatigue but carries sciatic nerve and wound risks; nonoperative care is non-invasive but may leave a residual strength deficit.","literature"
"acdf-allograft-vs-autograft","Anterior cervical fusion: structural allograft bone vs autogenous iliac crest bone graft","spine","which_operation","true","During ACDF, is structural allograft bone with plating or autogenous iliac crest bone graft (ICBG) preferred?","Structural allograft bone graft","Autogenous iliac crest bone graft","genuine_equipoise","Autograft (ICBG) provides the highest fusion rate but is associated with severe, chronic donor-site pain; allograft avoids harvest morbidity but has a slightly higher nonunion rate.","literature"
"tka-cemented-vs-cementless-fixation","Total knee arthroplasty: cemented vs cementless component fixation","knee","which_operation","true","In an active patient undergoing total knee arthroplasty, is cemented or cementless implant fixation preferred?","Cemented implant fixation","Cementless implant fixation","genuine_equipoise","Cemented TKA is the historic gold standard with reliable, long-term survival; cementless TKA utilizes biological ingrowth to preserve bone but has higher component costs and rare early loosening.","literature"
"dist-femur-fracture-distal-femoral-nail-vs-lateral-plate","Distal femur fracture: retrograde intramedullary nail vs lateral locking plate","lower_leg","which_operation","true","In an adult with a displaced extra-articular distal femur fracture, is retrograde distal femoral nailing or lateral locking plate fixation preferred?","Retrograde distal femoral nailing","Lateral locking plate fixation","genuine_equipoise","Retrograde nailing is a load-sharing, minimally invasive technique but can cause knee joint irritation; lateral plating allows anatomically precise fixation but requires extensive exposure.","literature"
"hip-arthroplasty-dual-mobility-vs-standard-cup","Total hip arthroplasty: dual-mobility bearing vs standard single-bearing cup","hip","which_operation","true","In an older adult undergoing total hip arthroplasty with high risk of instability, is a dual-mobility bearing or a standard single-bearing cup preferred?","Standard single-bearing cup","Dual-mobility bearing cup","genuine_equipoise","Dual-mobility designs dramatically reduce postoperative dislocation rates, but introduce an additional theoretical interface for wear and potential intra-prosthetic dislocation.","literature"
"midshaft-clavicle-nonunion-orif-with-graft-vs-plate-alone","Clavicle midshaft nonunion: plate fixation with bone graft vs plate fixation alone","shoulder","which_operation","true","In an adult with a symptomatic midshaft clavicle nonunion, is open reduction and plate fixation with bone grafting or plate fixation alone preferred?","Plate fixation alone","Plate fixation with bone grafting","genuine_equipoise","Bone grafting provides essential osteoinductive factors to stimulate healing in a nonunion, but plate fixation alone with rigid compression is often sufficient and avoids donor site morbidity.","literature"
